{
  "type": "tou",
  "id": "es_pvpc",
  "country": "ES",
  "label": "España — PVPC 2.0TD (punta/llano/valle)",
  "source_url": "https://www.esios.ree.es/es/pvpc",
  "fallback": "valle",
  "holidays_as": "valle",
  "bands": [
    { "id": "punta", "rank": 3, "label": "Punta", "color": "#ef4444" },
    { "id": "llano", "rank": 2, "label": "Llano", "color": "#f59e0b" },
    { "id": "valle", "rank": 1, "label": "Valle", "color": "#22c78b" }
  ],
  "seasons": [
    {
      "months": null,
      "rules": [
        { "band": "valle", "days": [0, 1, 2, 3, 4], "start": "00:00", "end": "08:00" },
        { "band": "llano", "days": [0, 1, 2, 3, 4], "start": "08:00", "end": "10:00" },
        { "band": "punta", "days": [0, 1, 2, 3, 4], "start": "10:00", "end": "14:00" },
        { "band": "llano", "days": [0, 1, 2, 3, 4], "start": "14:00", "end": "18:00" },
        { "band": "punta", "days": [0, 1, 2, 3, 4], "start": "18:00", "end": "22:00" },
        { "band": "llano", "days": [0, 1, 2, 3, 4], "start": "22:00", "end": "24:00" },
        { "band": "valle", "days": [5, 6], "start": "00:00", "end": "24:00" }
      ]
    }
  ]
}
