{
  "type": "tou",
  "id": "ru_threezone",
  "country": "RU",
  "label": "Россия — Трёхзонный тариф (пик/полупик/ночь)",
  "source_url": "https://www.mos.ru/news/item/129605073/",
  "fallback": "polupik",
  "bands": [
    { "id": "pik", "rank": 3, "label": "Пик", "color": "#ef4444" },
    { "id": "polupik", "rank": 2, "label": "Полупик", "color": "#f59e0b" },
    { "id": "noch", "rank": 1, "label": "Ночь", "color": "#22c78b" }
  ],
  "seasons": [
    {
      "months": null,
      "rules": [
        { "band": "noch", "days": [0, 1, 2, 3, 4, 5, 6], "start": "00:00", "end": "07:00" },
        { "band": "pik", "days": [0, 1, 2, 3, 4, 5, 6], "start": "07:00", "end": "10:00" },
        { "band": "polupik", "days": [0, 1, 2, 3, 4, 5, 6], "start": "10:00", "end": "17:00" },
        { "band": "pik", "days": [0, 1, 2, 3, 4, 5, 6], "start": "17:00", "end": "21:00" },
        { "band": "polupik", "days": [0, 1, 2, 3, 4, 5, 6], "start": "21:00", "end": "23:00" },
        { "band": "noch", "days": [0, 1, 2, 3, 4, 5, 6], "start": "23:00", "end": "24:00" }
      ]
    }
  ]
}
