{
  "type": "tou",
  "id": "default",
  "label": "Default",
  "fallback": "Default",
  "bands": [
    { "id": "Default", "rank": 1, "label": "Default", "color": "#29c7b0" }
  ],
  "seasons": [
    {
      "months": null,
      "rules": [
        { "band": "Default", "days": [0, 1, 2, 3, 4, 5, 6], "start": "00:00", "end": "24:00" }
      ]
    }
  ]
}
