{
  "type": "tou",
  "id": "jp_tepco_night8",
  "country": "JP",
  "label": "Japan — TEPCO おトクなナイト8 (giorno/notte)",
  "source_url": "https://www.tepco.co.jp/ep/private/plan/index-j.html",
  "fallback": "day",
  "bands": [
    { "id": "day", "rank": 2, "label": "昼間 (Day)", "color": "#ef4444" },
    { "id": "night", "rank": 1, "label": "夜間 (Night)", "color": "#22c78b" }
  ],
  "seasons": [
    {
      "months": null,
      "rules": [
        { "band": "night", "days": [0, 1, 2, 3, 4, 5, 6], "start": "00:00", "end": "07:00" },
        { "band": "night", "days": [0, 1, 2, 3, 4, 5, 6], "start": "23:00", "end": "24:00" }
      ]
    }
  ]
}
