{
  "type": "tou",
  "id": "gr_deddie",
  "country": "GR",
  "label": "Ελλάδα — Νυχτερινό / διζωνικό (ΔΕΔΔΗΕ)",
  "source_url": "https://www.deddie.gr/en/services/dual-zone-reduced-electricity-rates/",
  "fallback": "day",
  "bands": [
    { "id": "day", "rank": 2, "label": "Ημερήσιο", "color": "#ef4444" },
    { "id": "night", "rank": 1, "label": "Νυχτερινό", "color": "#22c78b" }
  ],
  "seasons": [
    {
      "months": [11, 12, 1, 2, 3],
      "rules": [
        { "band": "night", "days": [0, 1, 2, 3, 4, 5, 6], "start": "02:00", "end": "08:00" },
        { "band": "night", "days": [0, 1, 2, 3, 4, 5, 6], "start": "15:00", "end": "17:00" }
      ]
    },
    {
      "months": [4, 5, 6, 7, 8, 9, 10],
      "rules": [
        { "band": "night", "days": [0, 1, 2, 3, 4, 5, 6], "start": "23:00", "end": "24:00" },
        { "band": "night", "days": [0, 1, 2, 3, 4, 5, 6], "start": "00:00", "end": "07:00" }
      ]
    }
  ]
}
