{
  "type": "tou",
  "id": "si_bloki",
  "country": "SI",
  "label": "Slovenija — Omrežnina, časovni bloki (SODO 2024)",
  "source_url": "https://www.uro.si/prenova-omreznine/novi-casovni-bloki",
  "fallback": "b5",
  "bands": [
    { "id": "b1", "rank": 5, "label": "Blok 1", "color": "#b91c1c" },
    { "id": "b2", "rank": 4, "label": "Blok 2", "color": "#ef4444" },
    { "id": "b3", "rank": 3, "label": "Blok 3", "color": "#f59e0b" },
    { "id": "b4", "rank": 2, "label": "Blok 4", "color": "#84cc16" },
    { "id": "b5", "rank": 1, "label": "Blok 5", "color": "#22c78b" }
  ],
  "seasons": [
    {
      "months": [11, 12, 1, 2],
      "rules": [
        { "band": "b3", "days": [0, 1, 2, 3, 4], "start": "00:00", "end": "06:00" },
        { "band": "b2", "days": [0, 1, 2, 3, 4], "start": "06:00", "end": "07:00" },
        { "band": "b1", "days": [0, 1, 2, 3, 4], "start": "07:00", "end": "14:00" },
        { "band": "b2", "days": [0, 1, 2, 3, 4], "start": "14:00", "end": "16:00" },
        { "band": "b1", "days": [0, 1, 2, 3, 4], "start": "16:00", "end": "20:00" },
        { "band": "b2", "days": [0, 1, 2, 3, 4], "start": "20:00", "end": "22:00" },
        { "band": "b3", "days": [0, 1, 2, 3, 4], "start": "22:00", "end": "24:00" },
        { "band": "b4", "days": [5, 6], "start": "00:00", "end": "06:00" },
        { "band": "b3", "days": [5, 6], "start": "06:00", "end": "22:00" },
        { "band": "b4", "days": [5, 6], "start": "22:00", "end": "24:00" }
      ]
    },
    {
      "months": [3, 4, 5, 6, 7, 8, 9, 10],
      "rules": [
        { "band": "b5", "days": [0, 1, 2, 3, 4], "start": "00:00", "end": "06:00" },
        { "band": "b4", "days": [0, 1, 2, 3, 4], "start": "06:00", "end": "07:00" },
        { "band": "b3", "days": [0, 1, 2, 3, 4], "start": "07:00", "end": "14:00" },
        { "band": "b4", "days": [0, 1, 2, 3, 4], "start": "14:00", "end": "16:00" },
        { "band": "b3", "days": [0, 1, 2, 3, 4], "start": "16:00", "end": "20:00" },
        { "band": "b4", "days": [0, 1, 2, 3, 4], "start": "20:00", "end": "22:00" },
        { "band": "b5", "days": [0, 1, 2, 3, 4], "start": "22:00", "end": "24:00" },
        { "band": "b5", "days": [5, 6], "start": "00:00", "end": "06:00" },
        { "band": "b4", "days": [5, 6], "start": "06:00", "end": "22:00" },
        { "band": "b5", "days": [5, 6], "start": "22:00", "end": "24:00" }
      ]
    }
  ]
}
