{
  "type": "tou",
  "id": "bg_daynight",
  "country": "BG",
  "label": "България — Дневна / нощна тарифа",
  "source_url": "https://www.dker.bg/bg/ceni/ceni-na-elektricheskata-energiya.html",
  "fallback": "day",
  "bands": [
    { "id": "day", "rank": 2, "label": "Дневна", "color": "#ef4444" },
    { "id": "night", "rank": 1, "label": "Нощна", "color": "#22c78b" }
  ],
  "seasons": [
    {
      "months": [11, 12, 1, 2, 3],
      "rules": [
        { "band": "night", "days": [0, 1, 2, 3, 4, 5, 6], "start": "00:00", "end": "06:00" },
        { "band": "night", "days": [0, 1, 2, 3, 4, 5, 6], "start": "22:00", "end": "24:00" }
      ]
    },
    {
      "months": [4, 5, 6, 7, 8, 9, 10],
      "rules": [
        { "band": "night", "days": [0, 1, 2, 3, 4, 5, 6], "start": "00:00", "end": "07:00" },
        { "band": "night", "days": [0, 1, 2, 3, 4, 5, 6], "start": "23:00", "end": "24:00" }
      ]
    }
  ]
}
